{
    "$schema": "http://json-schema.org/draft-07/schema",
    "$id": "http://example.com/example.json",
    "type": "object",
    "title": "The Root Schema",
    "description": "The root schema comprises the entire JSON document.",
    "required": [
        "name",
        "training_phrases",
        "action",
        "parameters",
        "responses"     
    ],
    "properties": {
        "name": {
            "$id": "#/properties/name",
            "type": "string",
            "title": "The Name Schema",
            "description": "An explanation about the purpose of this instance."
        },
        "training_phrases": {
            "$id": "#/properties/training_phrases",
            "type": "object",
            "title": "The Training_phrases Schema",
            "description": "An explanation about the purpose of this instance.",
            "required": [
                "en",
                "es"
            ],
            "properties": {
                "en": {
                    "$id": "#/properties/training_phrases/properties/en",
                    "type": "array",
                    "title": "The En Schema",
                    "description": "An explanation about the purpose of this instance.",
                    "items": {
                        "$id": "#/properties/training_phrases/properties/en/items",
                        "type": "string",
                        "title": "The Items Schema",
                        "description": "An explanation about the purpose of this instance."
                    }
                },
                "es": {
                    "$id": "#/properties/training_phrases/properties/es",
                    "type": "array",
                    "title": "The Es Schema",
                    "description": "An explanation about the purpose of this instance.",
                    "items": {
                        "$id": "#/properties/training_phrases/properties/es/items",
                        "type": "string",
                        "title": "The Items Schema",
                        "description": "An explanation about the purpose of this instance."
                    }
                }
            }
        },
        "action": {
            "$id": "#/properties/action",
            "type": "string",
            "title": "The Action Schema",
            "description": "An explanation about the purpose of this instance.",
            "default": ""
        },
        "parameters": {
            "$id": "#/properties/parameters",
            "type": "array",
            "title": "The Parameters Schema",
            "description": "An explanation about the purpose of this instance.",
            "default": [],
            "items": {
                "$id": "#/properties/parameters/items",
                "type": "object",
                "title": "The Items Schema",
                "description": "An explanation about the purpose of this instance.",               
                "required": [
                    "name",
                    "required",
                    "prompts",
                    "entity"
                ],
                "properties": {
                    "name": {
                        "$id": "#/properties/parameters/items/properties/name",
                        "type": "string",
                        "title": "The Name Schema",
                        "description": "An explanation about the purpose of this instance."            
                    },
                    "required": {
                        "$id": "#/properties/parameters/items/properties/required",
                        "type": "boolean",
                        "title": "The Required Schema",
                        "description": "An explanation about the purpose of this instance.",
                        "default": false                        
                    },
                    "prompts": {
                        "$id": "#/properties/parameters/items/properties/prompts",
                        "type": "object",
                        "title": "The Prompts Schema",
                        "description": "An explanation about the purpose of this instance.",
                        "required": [
                            "en",
                            "es"
                        ],
                        "properties": {
                            "en": {
                                "$id": "#/properties/parameters/items/properties/prompts/properties/en",
                                "type": "array",
                                "title": "The En Schema",
                                "description": "An explanation about the purpose of this instance.",
                                "items": {
                                    "$id": "#/properties/parameters/items/properties/prompts/properties/en/items",
                                    "type": "string",
                                    "title": "The Items Schema",
                                    "description": "An explanation about the purpose of this instance."                                
                                }
                            },
                            "es": {
                                "$id": "#/properties/parameters/items/properties/prompts/properties/es",
                                "type": "array",
                                "title": "The Es Schema",
                                "description": "An explanation about the purpose of this instance.",
                                "items": {
                                    "$id": "#/properties/parameters/items/properties/prompts/properties/es/items",
                                    "type": "string",
                                    "title": "The Items Schema",
                                    "description": "An explanation about the purpose of this instance."
                                }
                            }
                        }
                    },
                    "entity": {
                        "$id": "#/properties/parameters/items/properties/entity",
                        "type": "string",
                        "title": "The Entity Schema",
                        "description": "An explanation about the purpose of this instance."
                    }
                }
            }
        },
        "responses": {
            "$id": "#/properties/responses",
            "type": "object",
            "title": "The Responses Schema",
            "description": "An explanation about the purpose of this instance.",
            "required": [
                "en",
                "es"
            ],
            "properties": {
                "en": {
                    "$id": "#/properties/responses/properties/en",
                    "type": "array",
                    "title": "The En Schema",
                    "description": "An explanation about the purpose of this instance.",
                    "items": {
                        "$id": "#/properties/responses/properties/en/items",
                        "type": "string",
                        "title": "The Items Schema",
                        "description": "An explanation about the purpose of this instance."  
                    }
                },
                "es": {
                    "$id": "#/properties/responses/properties/es",
                    "type": "array",
                    "title": "The Es Schema",
                    "description": "An explanation about the purpose of this instance.",
                    "items": {
                        "$id": "#/properties/responses/properties/es/items",
                        "type": "string",
                        "title": "The Items Schema",
                        "description": "An explanation about the purpose of this instance."                        
                    }
                }
            }
        }         
    }
}